{
  "$schema": "https://json-schema.org/draft/2020-12/schema",
  "$id": "https://language-learning.local/content-batch.schema.json",
  "title": "Language Learning Content Batch",
  "type": "object",
  "required": [
    "batch_id",
    "course",
    "learner_language",
    "target_language",
    "target_variant",
    "cefr",
    "curriculum_unit",
    "items"
  ],
  "properties": {
    "batch_id": {"type": "string", "minLength": 1},
    "course": {"type": "string", "minLength": 1},
    "learner_language": {"type": "string", "minLength": 2, "maxLength": 16},
    "learner_variant": {"type": "string", "minLength": 2, "maxLength": 32},
    "target_language": {"type": "string", "minLength": 2, "maxLength": 16},
    "target_variant": {"type": "string", "minLength": 2, "maxLength": 32},
    "cefr": {"enum": ["Pre-A1", "A1", "A2", "B1", "B2", "C1", "C2"]},
    "curriculum_unit": {"type": "string", "minLength": 1},
    "generator": {"type": "string"},
    "items": {
      "type": "array",
      "minItems": 1,
      "items": {
        "type": "object",
        "required": ["kind", "data"],
        "properties": {
          "kind": {
            "enum": [
              "concept",
              "lexeme",
              "word_form",
              "utterance",
              "grammar_point",
              "dialogue",
              "exercise"
            ]
          },
          "external_id": {"type": "string"},
          "data": {"type": "object"}
        },
        "additionalProperties": false
      }
    }
  },
  "additionalProperties": false
}
