{
  "batch_id":"ko-kr-prea1-ready-for-a1-v1",
  "course":"fa-ko-kr",
  "learner_language":"fa",
  "learner_variant":"fa-IR",
  "target_language":"ko",
  "target_variant":"ko-KR",
  "cefr":"Pre-A1",
  "curriculum_unit":"prea1-ko-ready-for-a1",
  "generator":"gpt-5.6-sol:zero-learner-foundation-v1",
  "items":[
    {"kind":"dialogue","external_id":"d_ko_ready_intro","data":{"lesson_key":"prea1-ko-ready-for-a1-01","title":"첫 짧은 대화","setting":"language_class","cefr":"Pre-A1","topic":"simple-messages","characters":["서연","준호"],"turns":[{"order":1,"speaker":"서연","text":"안녕하세요. 이름이 뭐예요?","translation_fa":"سلام. اسمتان چیست؟"},{"order":2,"speaker":"준호","text":"다시 말해 주세요.","translation_fa":"لطفاً دوباره بگویید."},{"order":3,"speaker":"서연","text":"이름이 뭐예요?","translation_fa":"اسمتان چیست؟"},{"order":4,"speaker":"준호","text":"저는 준호예요.","translation_fa":"من جونهو هستم."}],"status":"validated"}},
    {"kind":"exercise","external_id":"ex_ko_ready_build_block","data":{"lesson_key":"prea1-ko-ready-for-a1-01","exercise_type":"multiple_choice","prompt":{"instruction_fa":"کدام بلوک از ㄱ + ㅏ ساخته شده؟","value":"ㄱ + ㅏ"},"options":["가","고","나","아"],"answer":{"value":"가"},"difficulty":1,"cefr":"Pre-A1","status":"validated","feedback":{"explanation_fa":"ㄱ + ㅏ = 가.","model_answer":"가","retry_tip_fa":"صامت و واکه را داخل یک بلوک ببین."}}},
    {"kind":"exercise","external_id":"ex_ko_ready_ieung","data":{"lesson_key":"prea1-ko-ready-for-a1-01","exercise_type":"multiple_choice","prompt":{"instruction_fa":"در کدام گزینه ㅇ در ابتدای هجا بی‌صداست؟","value":"silent initial"},"options":["아","강","공","밤"],"answer":{"value":"아"},"difficulty":1,"cefr":"Pre-A1","status":"validated","feedback":{"explanation_fa":"در 아، ㅇ آغازین فقط جای صامت را پر می‌کند.","model_answer":"아","retry_tip_fa":"جای ㅇ را داخل بلوک بررسی کن."}}},
    {"kind":"exercise","external_id":"ex_ko_ready_listen","data":{"lesson_key":"prea1-ko-ready-for-a1-01","exercise_type":"listening","prompt":{"instruction_fa":"کدام هجا را شنیدی؟","audio_text":"공"},"options":["공","고","오","강"],"answer":{"value":"공"},"difficulty":1,"cefr":"Pre-A1","status":"validated","feedback":{"explanation_fa":"공 با ㅇ پایانی تمام می‌شود و صدای ng دارد.","model_answer":"공","retry_tip_fa":"به صدای پایانی هجا گوش کن.","transcript_en":"공"}}},
    {"kind":"dialogue","external_id":"d_ko_ready_repair","data":{"lesson_key":"prea1-ko-ready-for-a1-02","title":"모를 때","setting":"language_class","cefr":"Pre-A1","topic":"simple-messages","characters":["하나","태호"],"turns":[{"order":1,"speaker":"하나","text":"이건 우산이에요.","translation_fa":"این چتر است."},{"order":2,"speaker":"태호","text":"무슨 뜻이에요?","translation_fa":"یعنی چه؟"},{"order":3,"speaker":"하나","text":"우산이에요.","translation_fa":"چتر است."},{"order":4,"speaker":"태호","text":"아, 알겠어요. 감사합니다.","translation_fa":"آها، فهمیدم. ممنونم."}],"status":"validated"}},
    {"kind":"exercise","external_id":"ex_ko_ready_repeat","data":{"lesson_key":"prea1-ko-ready-for-a1-02","exercise_type":"multiple_choice","prompt":{"instruction_fa":"برای درخواست تکرار کدام عبارت مناسب است؟","value":"repeat"},"options":["다시 말해 주세요.","감사합니다.","안녕하세요.","괜찮아요."],"answer":{"value":"다시 말해 주세요."},"difficulty":1,"cefr":"Pre-A1","status":"validated","feedback":{"explanation_fa":"다시 말해 주세요. یعنی «لطفاً دوباره بگویید». ","model_answer":"다시 말해 주세요.","retry_tip_fa":"عبارت دارای 다시 را انتخاب کن."}}},
    {"kind":"exercise","external_id":"ex_ko_ready_meaning","data":{"lesson_key":"prea1-ko-ready-for-a1-02","exercise_type":"multiple_choice","prompt":{"instruction_fa":"برای پرسیدن معنی کدام عبارت مناسب است؟","value":"meaning"},"options":["무슨 뜻이에요?","저는 준호예요.","안녕하세요.","네."],"answer":{"value":"무슨 뜻이에요?"},"difficulty":1,"cefr":"Pre-A1","status":"validated","feedback":{"explanation_fa":"무슨 뜻이에요? یعنی «یعنی چه؟».","model_answer":"무슨 뜻이에요?","retry_tip_fa":"عبارت دارای 뜻 یعنی «معنی» را انتخاب کن."}}},
    {"kind":"exercise","external_id":"ex_ko_ready_speak","data":{"lesson_key":"prea1-ko-ready-for-a1-02","exercise_type":"speaking","prompt":{"instruction_fa":"خودت را خیلی کوتاه معرفی کن.","value":"저는 준호예요."},"answer":{"expected_text":"저는 준호예요."},"difficulty":1,"cefr":"Pre-A1","status":"validated","feedback":{"explanation_fa":"هدف یک معرفی کوتاه، مؤدبانه و قابل‌فهم است.","model_answer":"저는 준호예요.","retry_tip_fa":"جمله را آرام و پیوسته بگو."}}},
    {"kind":"grammar_point","external_id":"g_ko_ready_gate","data":{"lesson_key":"prea1-ko-ready-for-a1-02","slug":"g-prea1-ko-ready-gate","title":"A1 준비 완료","rule_summary":"Readiness means decoding simple Hangul blocks, recognizing a few basic batchim patterns, following tiny supported audio, using polite survival chunks and repairing a misunderstanding.","explanation":{"fa":"برای ورود به A1 لازم نیست کل هانگول و همهٔ قواعد تلفظ را کامل بلد باشی. باید بتوانی بلوک‌های ساده را بخوانی، جای ㅇ و 받침 پایه را بفهمی، چند عبارت کوتاه را دنبال کنی، خودت را معرفی کنی و اگر گیر کردی معنی یا تکرار بخواهی."},"examples":[{"ko":"가 / 아 / 공","fa":"خواندن بلوک‌های ساده"},{"ko":"다시 말해 주세요.","fa":"درخواست تکرار"},{"ko":"무슨 뜻이에요?","fa":"پرسیدن معنی"}],"cefr":"Pre-A1","status":"validated","audio_examples":true}}
  ]
}